{
  "$schema": "https://json-schema.org/draft/2020-12/schema",
  "$id": "events/ops-core/recall/sale-lock-activated.v1.json",
  "title": "Sale Lock Activated Event v1",
  "description": "Published when sale lock becomes active. Payload includes sale-lock scope needed for business-platform to stop quote, order, AI, CRM, Ads, and Live flows for the affected scope.",
  "$comment": "Sources: PACK-01 Sale Lock / Stop Sale; TECH-03 Consumer suppression; OD-RCL-03 (2026-07-17). Every durable activation is paired with ops-core.recall.stop-sale-required.v1 for the same scope in the same outbox transaction; recall-case creation alone is not this trigger.",
  "type": "object",
  "additionalProperties": false,
  "properties": {
    "eventId": {
      "type": "string",
      "minLength": 1,
      "description": "Unique event identifier."
    },
    "eventType": {
      "type": "string",
      "const": "ops-core.recall.sale-lock-activated.v1",
      "description": "Stable event type including source, domain, name, and v1 suffix."
    },
    "eventVersion": {
      "type": "string",
      "const": "1.0",
      "description": "Event contract version."
    },
    "occurredAt": {
      "type": "string",
      "format": "date-time",
      "description": "Time the domain event occurred."
    },
    "source": {
      "type": "string",
      "const": "ops-core",
      "description": "System that owns and emits this event."
    },
    "correlationId": {
      "type": "string",
      "minLength": 1,
      "description": "Cross-system correlation identifier."
    },
    "causationId": {
      "type": "string",
      "minLength": 1,
      "description": "Optional parent command, event, or workflow identifier."
    },
    "idempotencyKey": {
      "type": "string",
      "minLength": 1,
      "description": "Required when emitted from retryable or high-risk command; optional for derived read-model notifications."
    },
    "data": {
      "allOf": [
        {
          "$ref": "../../../schemas/ops/sale-lock.schema.json"
        },
        {
          "type": "object",
          "required": [
            "sale_lock_id",
            "scope_type",
            "scope_id",
            "active",
            "reason",
            "effective_from"
          ],
          "properties": {
            "active": {
              "const": true
            }
          }
        }
      ]
    }
  },
  "required": [
    "eventId",
    "eventType",
    "eventVersion",
    "occurredAt",
    "source",
    "correlationId",
    "data"
  ]
}
